{
  "title": "How to Make a Work Plan: A Step-by-Step Guide",
  "authors": [
    "Yiyang Zhang",
    "Yuhang Zhao"
  ],
  "tags": [
    "Content"
  ],
  "description": "How to make a work plan, a definitive step by step guide by AFFiNE ",
  "created": 1705881600000,
  "updated": 1705881600000,
  "layout": "blog",
  "id": "moJn5FfebN_njErqBi0tD",
  "slug": "how-to-make-work-plan-step-by-step-guide",
  "cover": "https://app.affine.pro/api/workspaces/qf73AF6vzWphbTJdN7KiX/blobs/dZxm1eTdebIBNBcTM18AIoUpW-8xKARUdXXDeoNTsDs=.webp",
  "md": "---\n\ntitle: \"How to Make a Work Plan: A Step-by-Step Guide\"\n\nauthor: \"Yiyang Zhang, Yuhang Zhao\"\n\ntags: Content\n\nslug: how-to-make-work-plan-step-by-step-guide\n\ndescription: \"How to make a work plan, a definitive step by step guide by AFFiNE \"\n\ncreated: 2024-01-22\n\nupdated: 2024-01-22\n\nlayout: blog\n\npublish: true\n\n---\n\n\n![dZxm1eTdebIBNBcTM18AIoUpW-8xKARUdXXDeoNTsDs=](https://app.affine.pro/api/workspaces/qf73AF6vzWphbTJdN7KiX/blobs/dZxm1eTdebIBNBcTM18AIoUpW-8xKARUdXXDeoNTsDs=.webp)\n\nAre you feeling overwhelmed and disorganized at work?\n\nDo you find yourself constantly juggling multiple tasks without a clear plan in sight?\n\nIf so, it's time to discover the power of a work plan.\n\nA work plan is not just a fancy term; it's your secret weapon for achieving productivity and success. In this article, we will show you how to create a work plan that will revolutionize the way you approach your tasks. Get ready to take control of your workload and unleash your full potential!\n\n# What is a Work Plan?\n\nA work plan is akin to your project's guiding star, an intricately designed roadmap leading you to your desired destination. It encompasses far more than a mere list of tasks; it's your key to organizational structure and unwavering clarity.\n\nWithin its lines, you find the power to prioritize, allocate resources with precision, and establish timelines that are not just realistic but readily attainable. Complex projects, often daunting, are seamlessly broken down into manageable steps.\n\nLike a trusted compass, your work plan becomes your faithful guide through the labyrinth of professional challenges. With its assistance, you gain a heightened sense of focus and efficiency, the driving forces that propel your projects toward extraordinary success.\n\n# Why Do You Need a Work Plan?\n\n\n![Ceous7Wev7OEqN5XRHv5ngjmZ2YBmtafU3UFMaXJd0Q=](https://app.affine.pro/api/workspaces/qf73AF6vzWphbTJdN7KiX/blobs/Ceous7Wev7OEqN5XRHv5ngjmZ2YBmtafU3UFMaXJd0Q=.webp)\n\n* **Provide clarity.** It outlines what needs to be done when it needs to be done, and who is responsible for each [task](https://affine.pro/blog/best-free-task-management-software-streamline-workflow). This not only ensures that everyone is on the same page but also helps prevent any confusion or misunderstandings along the way.\n\n* **Promote efficiency.** By breaking down larger objectives into smaller, actionable steps, you can prioritize tasks and allocate resources accordingly. This allows you to manage your time effectively and avoid getting overwhelmed by an impossibly long to-do list.\n\n* **Foster accountability.** When responsibilities are clearly defined and deadlines are set, team members know exactly what is expected of them. This encourages individuals to take ownership of their role in the project and increases overall [productivity](https://affine.pro/blog/top-free-workflow-temlplates-to-consider).\n\n* **Better monitoring and evaluation of progress.** By regularly reviewing your plan against actual results achieved, you can identify any gaps or areas that need improvement. This enables you to make necessary adjustments along the way and ensure that you stay on track toward reaching your goals.\n\n# Step-by-Step Guide to Creating a Work Plan\n\n\n![nriXpe_FMFHW1YD8O1mOoedZQoLg3o0JUl3vvYyDq0Q=](https://app.affine.pro/api/workspaces/qf73AF6vzWphbTJdN7KiX/blobs/nriXpe_FMFHW1YD8O1mOoedZQoLg3o0JUl3vvYyDq0Q=.webp)\n\nCreating a work plan is an essential step in any project or task. It helps to outline the necessary steps and ensures that everything is organized and on track. Here's a step-by-step guide to help you create an effective work plan.\n\n### Step 1: Define Your Objectives\n\nBegin by clearly defining the objectives of your project or endeavor. What do you want to achieve? Make sure your goals are specific, measurable, achievable, relevant, and time-bound (SMART).\n\nLeveraging AFFiNE's [SMART framework template](https://affine.pro/blog/marketing-action-plan) is key to establishing well-defined, attainable objectives. This approach is greatly improved by utilizing a digital whiteboard, providing a shared, visual space for strategizing. Wanna get started with this layout right away, [click here](https://app.affine.pro)**!**\n\n\n![uw1QbjQQwBE5oc4NSe5ctidKaWHVr5HTPS3c8nPey_Y=](https://app.affine.pro/api/workspaces/qf73AF6vzWphbTJdN7KiX/blobs/uw1QbjQQwBE5oc4NSe5ctidKaWHVr5HTPS3c8nPey_Y=.webp)\n\n### Step 2: Identify Tasks and Activities\n\nBreak down your objectives into individual tasks and activities. List everything that needs to be done to accomplish your goals. Be thorough in this step.\n\nAFFiNE's [concept map](https://affine.pro/blog/top-8-concept-map-templates-examples) and [flowchart templates](https://affine.pro/blog/10-best-flowchart-software-tools-2023-features-pricing) can assist you in breaking down logic and clarifying definitions, ensuring every project has a clear beginning!\n\n\n![pxhD46X-uF6kOOtmL9Hjkd8N_mFa-F2hpnTIVSXVVH8=](https://app.affine.pro/api/workspaces/qf73AF6vzWphbTJdN7KiX/blobs/pxhD46X-uF6kOOtmL9Hjkd8N_mFa-F2hpnTIVSXVVH8=.webp)\n\n### Step 3: Prioritize and Set Milestones\n\nPrioritize your tasks based on their importance and dependencies. Establish milestones or key checkpoints that will help you track progress and stay on schedule.\n\n### Step 4: Allocate Resources\n\nIdentify the resources needed for each task, including budget, personnel, equipment, and materials. Ensure you have the necessary resources available and allocate them effectively.\n\nOur [Gantt Chart template](https://app.affine.pro) rises to the occasion, providing a detailed timeline visualization that's ideal for solo freelancers juggling various gigs as well as corporate teams handling intricate projects. It's an essential asset for those in [project management](https://affine.pro/blog/10-best-free-smart-sheet-alternatives-for-project-management-2023) and a simple yet effective option for anyone looking to enhance their project supervision. Wanna get started with this layout right away, [click here](https://app.affine.pro)**!**\n\n\n![HXt-rrleLz1hrCB9KH6KXc5B2LMiKLEvJX3hq3NU13I=](https://app.affine.pro/api/workspaces/qf73AF6vzWphbTJdN7KiX/blobs/HXt-rrleLz1hrCB9KH6KXc5B2LMiKLEvJX3hq3NU13I=.webp)\n\n### Step 5: Create a Timeline\n\nDevelop a realistic timeline for your work plan. Set deadlines for each task and milestone, taking into account any dependencies and constraints. Be sure to allow some flexibility for unexpected delays.\n\nAFFiNE's [monthly calendar template](https://affine.pro/blog/free-8-printable-customizable-monthly-calendar-templates-examples) can turn complex timelines into a fun experience. Not only can you create schedules for your to-do items, but you can also allow your team to collaboratively edit the calendar, synchronizing deadlines for each project.\n\n\n![ZAXvtvvRkizy3LjSy5Tz_vS96f_SFCH7tK4STjv2WS0=](https://app.affine.pro/api/workspaces/qf73AF6vzWphbTJdN7KiX/blobs/ZAXvtvvRkizy3LjSy5Tz_vS96f_SFCH7tK4STjv2WS0=.webp)\n\n### Step 6: Monitor and Adjust\n\nOnce your work plan is in action, regularly monitor progress. Compare actual progress to your plan and make adjustments as needed. Be flexible and responsive to changes, ensuring you stay on track to meet your objectives.\n\nBy following this step-by-step guide, you can create a comprehensive work plan that sets clear expectations, [improves efficiency](https://affine.pro/blog/9-top-examples-data-entry-software-programs-to-boost-your-productivity-2023), and increases the chances of completing your project or task within schedule.\n\n\n![JEAWWEj9dlB-xw9bsZU-uxG8pxh2zBDMW6fkCKQ4N1A=](https://app.affine.pro/api/workspaces/qf73AF6vzWphbTJdN7KiX/blobs/JEAWWEj9dlB-xw9bsZU-uxG8pxh2zBDMW6fkCKQ4N1A=.webp)\n\n## Well Begin with AFFiNE Calendar\n\nEmbarking on work management is like crafting a masterpiece, and you need the right set of brushes and colors - a work plan. An agile work plan is created by the top-notch tool, that is, **AFFiNE**. Your ultimate tool brings planning, sorting, and creation into perfect harmony. Think of AFFiNE as the artist's palette, where your projects take shape on the canvas of project management.\n\n**AFFiNE** is the powerhouse that centralizes your work, connects seamlessly with numerous apps, and provides a comprehensive view of your projects, with a wealth of customizable features and an extensive template gallery for all your needs.\n\n\n\n<div style=\"text-align:center;\">\n\n<iframe width=\"560\" height=\"315\" src=\"https://www.youtube.com/embed/3cfeKOufZWU?si=IiXDIdwfnM2Z7KPL\" title=\"YouTube video player\" frameborder=\"0\" allow=\"accelerometer; autoplay; clipboard-write; encrypted-media; gyroscope; picture-in-picture; web-share\" allowfullscreen></iframe>\n\n</div>\n\n\n\n**AFFiNE's Brilliant Features:**\n\n* **Template Gallery in AFFiNE:** There is a curated collection of [powerful whiteboard templates](https://affine.pro/blog/affine-0-11-0-launch-day-4-navigating-canvas-complexity-templates-clarity-free-online-whiteboard) in AFFiNE. From the robust Gantt chart to the insightful storyboard and the comprehensive monthly calendar template, an array of additional templates awaits your exploration, promising to expand the horizons of your project planning and execution. These templates serve as your launchpad, enabling you to skip the groundwork and jump straight into action. Choose a storyboard template and start your storytelling journey!\n\n\n![OP3GdbE7dwmQKK2uKzBgJbhpVJxkLuDsVtomxcggvSQ=](https://app.affine.pro/api/workspaces/qf73AF6vzWphbTJdN7KiX/blobs/OP3GdbE7dwmQKK2uKzBgJbhpVJxkLuDsVtomxcggvSQ=.webp)\n\n* **Robust Database of Table & Kanban:** Easily create, organize, and track your daily tasks like never before. AFFiNE Table view allows you to track every work plan visually. With AFFiNE's Kanban view, you have the flexibility to classify based on your scheduling property and move entire columns or individual Kanban cards to your preferred locations effortlessly.\n\n\n![wzNppJMgVjC8ThVR9TlhVkPu5OXTEsEsqnuv-Xmrr0g=](https://app.affine.pro/api/workspaces/qf73AF6vzWphbTJdN7KiX/blobs/wzNppJMgVjC8ThVR9TlhVkPu5OXTEsEsqnuv-Xmrr0g=.webp)\n\n* **Appealing Collaboration Capability:** When you do need to collaborate with other contributors, AFFiNE makes getting feedback simple. Appealing [collaboration](https://affine.pro/blog/top-asynchronous-communication-tools-free-2024) capability provides visibility into assigned tasks, making project timelines easier to estimate, and ensuring your work plan remains well-designed.\n\n\n![O88V12dZ7eALpdMD8-6eyyfRec5yZyWiQxCnvNEb3r0=](https://app.affine.pro/api/workspaces/qf73AF6vzWphbTJdN7KiX/blobs/O88V12dZ7eALpdMD8-6eyyfRec5yZyWiQxCnvNEb3r0=.webp)\n\nStart your work plan journey with **AFFiNE** today and watch your projects come to life with ease.  Presently, AFFiNE has launched its [Stable Version](https://affine.pro/download), with ongoing efforts to develop a more comprehensive and dependable iteration.\n\nJoin us on our voyage through our social media channels and be part of the experience. **Come and join us on our journey over on our media platforms.**\n\n* Official Website: [https://affine.pro/](https://affine.pro/)\n\n* GitHub: [https://github.com/toeverything/AFFiNE](https://github.com/toeverything/AFFiNE)\n\n* Discord: [https://discord.gg/Arn7TqJBvG](https://discord.gg/Arn7TqJBvG)\n\n* Twitter: [https://twitter.com/AffineOfficial](https://twitter.com/AffineOfficial)\n\n\n\n\n\n\n\n",
  "publish": true
}