{
  "title": "How to Create a Project Timeline Template in Excel - Step-by-Step Guide",
  "authors": [
    "Yanxi Liu"
  ],
  "tags": [
    "Content"
  ],
  "description": null,
  "created": 1711324800000,
  "updated": 1711324800000,
  "layout": "blog",
  "id": "VzaGjcsQg6iOQMKEwv13V",
  "slug": "how-to-create-a-project-timeline-template-in-excel-step-by-step-guide",
  "cover": "https://app.affine.pro/api/workspaces/qf73AF6vzWphbTJdN7KiX/blobs/6k1miQii5XU-zy_3RkTvVLbPFsIq6ifYUsXDbYrmaAs=",
  "md": "---\n\n\ntitle: \"How to Create a Project Timeline Template in Excel - Step-by-Step Guide\"\n\n\nauthor: \"Yanxi Liu\"\n\n\ntags: Content\n\n\nslug: how-to-create-a-project-timeline-template-in-excel-step-by-step-guide\n\n\nDescription: Learn how to create stunning timelines in Excel with our comprehensive tutorials and access a collection of professionally designed templates, making it easy to visualize project schedules, historical events, or personal milestones with precision and efficiency.\n\n\ncreated: 2024-03-25\n\n\nupdated: 2024-03-25\n\n\nlayout: blog\n\n\npublish: true\n\n\n---\n\n\n\n![6k1miQii5XU-zy_3RkTvVLbPFsIq6ifYUsXDbYrmaAs=](https://app.affine.pro/api/workspaces/qf73AF6vzWphbTJdN7KiX/blobs/6k1miQii5XU-zy_3RkTvVLbPFsIq6ifYUsXDbYrmaAs=)\n\n\n# **Why should we use a project timeline template in Excel?**\n\n\nA project timeline is essential for effective project management, providing a clear roadmap for your work-related projects. By plotting key dates, such as meetings, milestones, and deadlines, you can [manage your time and resources](https://affine.pro/blog/10-best-airtable-alternatives-to-manage-your-project-free-paid) efficiently.\n\n\nAn Excel project timeline template enhances productivity by providing tangible goals and milestones. By highlighting key milestones, you can establish targets that [encourage collaboration](https://affine.pro/blog/power-of-collaboration-why-teams-need-to-work-together-for-success) and engagement among team members, leading to increased employee satisfaction and better project outcomes.\n\n\nWhile Excel project timeline templates offer many benefits, they also have some drawbacks to consider:\n\n\n1. Limited visual customization: Excel is primarily a spreadsheet software, so the visual customization options for timelines are limited.\n\n\n1. Lack of collaboration features: Excel is not inherently designed for real-time collaboration. Sharing an Excel file among team members can lead to version control issues, as multiple people may be working on the same document simultaneously.\n\n\n1. Difficulty in tracking dependencies: Excel timelines may lack advanced features for tracking dependencies between tasks.\n\n\n\n\n\n# **Step by Step Guide on How to Create Your Project Timeline**\n\n\n##### 1. Open a blank Excel worksheet. Click Insert tab > SmartArt > Process.\n\n\n\n![T7-UpB5U376ehiTlT3CSLyufhCAjRs2N3wsK20Nq00A=](https://app.affine.pro/api/workspaces/qf73AF6vzWphbTJdN7KiX/blobs/T7-UpB5U376ehiTlT3CSLyufhCAjRs2N3wsK20Nq00A=)\n\n\n##### 2. Then select Basic Timeline from the Graphic options. You may also choose other graphics templates that suit your needs.\n\n\n\n![9PxjaPwAdn4j-ib1I7PcC5l4cD-jaFePJDHjdyb0x9c=](https://app.affine.pro/api/workspaces/qf73AF6vzWphbTJdN7KiX/blobs/9PxjaPwAdn4j-ib1I7PcC5l4cD-jaFePJDHjdyb0x9c=)\n\n\n##### 3. Add data from the timeline (start date, milestones, end date, etc.) either in the provided text pane or directly on the timeline.\n\n\n\n![x6n44l3Znlt1X5iRmkEq-kDJ19cXTIMEfRYwhcv7F4c=](https://app.affine.pro/api/workspaces/qf73AF6vzWphbTJdN7KiX/blobs/x6n44l3Znlt1X5iRmkEq-kDJ19cXTIMEfRYwhcv7F4c=)\n\n\n##### 4. Excel also allows you to change the style of a timeline. To do so, simply right-click to change the theme style, fill color, and outline styles.\n\n\n\n![ZYEGpX0l-DdpMmhYgiD4-W257gZDEaIBNoTDwF_yeGc=](https://app.affine.pro/api/workspaces/qf73AF6vzWphbTJdN7KiX/blobs/ZYEGpX0l-DdpMmhYgiD4-W257gZDEaIBNoTDwF_yeGc=)\n\n\nSuccessfully, youâ€™re all set.\n\n\n# **Creatively Making a Project Timeline Template Using [AFFiNE](http://affine.pro)**\n\n\nExcelâ€™s timelines can be helpful. However, we have to admit that Excel Project Timeline templates sometimes are too simple and hard to understand. Therefore, here we present you AFFiNE, the next-gen project management tool that helps you plan and visualize your projects.\n\n\n**AFFiNE** is not only a tool for creating your project timeline template; it's a visually dynamic and feature-rich tool designed specifically for project managers. With **AFFiNE**, you can easily plan, track, and deliver your projects on time, ensuring efficiency and success. Designed exclusively for project management and process improvement purposes. Additionally, **AFFiNE** provides a comprehensive solution for organizations seeking to streamline their operations with confidence.\n\n\n\n\n\n<div style=\"text-align:center;\">\n<iframe width=\"560\" height=\"315\" src=\"https://www.youtube.com/embed/WqOe9HgpsDY?si=PHGuSeRbOT9GxuPO\" title=\"YouTube video player\" frameborder=\"0\" allow=\"accelerometer; autoplay; clipboard-write; encrypted-media; gyroscope; picture-in-picture; web-share\" allowfullscreen></iframe>\n</div>\n\n\nAFFiNE provides professionals with a unified platform that enables them to plan a knowledge base, collaborate with teammates, and develop content. This flexible tool empowers users to brainstorm, take notes, and set their goals while staying in sync and building content with blocks. The limitless workspace stimulates user-driven innovation. AFFiNE offers safe data storage, open-source benefits, and collaborative functionality. Users can visualize and connect information effortlessly, making business model Canvas templates an engaging and enjoyable experience.\n\n\n**Key features:**\n\n\n* **Template Gallery in AFFiNE:** There is a curated collection of powerful whiteboard templates in AFFiNE. From the robust Gantt chart to the insightful concept map and the comprehensive monthly calendar, an array of additional templates awaits your exploration, promising to expand the horizons of your project planning and execution. These templates serve as your launchpad, enabling you to skip the groundwork and jump straight into action. Crafted for seamless collaboration, AFFiNE's templates provide structured canvases for various tasks, saving you valuable time and enhancing efficiency in project management, content creation, and planning.\n\n\n\n![OP3GdbE7dwmQKK2uKzBgJbhpVJxkLuDsVtomxcggvSQ=](https://app.affine.pro/api/workspaces/qf73AF6vzWphbTJdN7KiX/blobs/OP3GdbE7dwmQKK2uKzBgJbhpVJxkLuDsVtomxcggvSQ=)\n\n\n* **Seamless Integration and Enhanced Organization:** Effortlessly elevate your business model Canvas templates with AFFiNE's dynamic page blocks, allowing you to incorporate diverse elements such as images, attachments, and databases. Cut directly from pages, these versatile blocks provide the freedom to rearrange and design your whiteboard with flexibility. Our innovative auto-connect feature simplifies the process of binding related blocks together without requiring manual line drawing, maintaining a cohesive and uninterrupted flow for your business model Canvas templates.\n\n\n\n![spfYo1qPD6HE9uAojVPEbfp0dFegMZwx1sGbGA-b_BU=](https://app.affine.pro/api/workspaces/qf73AF6vzWphbTJdN7KiX/blobs/spfYo1qPD6HE9uAojVPEbfp0dFegMZwx1sGbGA-b_BU=)\n\n\n* **Collaborative Editing:** Multiple users can seamlessly collaborate in real-time on the same business model canvas, fostering collective input and refinement. Invite your [team members](https://affine.pro/blog/team-building-activities-for-collaboration-success) into one workspace regardless of their location or time zone.\n\n\n\n![O88V12dZ7eALpdMD8-6eyyfRec5yZyWiQxCnvNEb3r0=](https://app.affine.pro/api/workspaces/qf73AF6vzWphbTJdN7KiX/blobs/O88V12dZ7eALpdMD8-6eyyfRec5yZyWiQxCnvNEb3r0=)\n\n\n* **Show Your Business Model Canvas Templates with AFFiNE's Single Page Sharing:** No more oversharing of your workspace; now, you can precisely control what's shared with just a few clicks. AFFiNE's single-page sharing makes business model canvas improvement simple, offering a tailored approach to showing your business model canvas to your business partners.\n\n\n\n![VsmRQKKT_JWfocv6kdTdmSw3-22k1EUrdWeyjhL8xjQ=](https://app.affine.pro/api/workspaces/qf73AF6vzWphbTJdN7KiX/blobs/VsmRQKKT_JWfocv6kdTdmSw3-22k1EUrdWeyjhL8xjQ=)\n\n\nSo why wait? Start exploring AFFiNE today and take your process mapping to new heights! The timing is opportune, and it's never too late to embark on this transformative journey. Commence improving your plans by using AFFiNE's user-friendly tool. Presently, AFFiNE has launched its [**Stable Version**](https://affine.pro/download), with ongoing efforts to develop a more comprehensive and dependable iteration. Join us on our voyage through our social media channels and be part of the experience. **Come and join us on our journey over on our media platforms. ðŸš€**\n\n\n* Official Website: [https://affine.pro/](https://affine.pro/)\n\n\n* GitHub: [https://github.com/toeverything/AFFiNE](https://github.com/toeverything/AFFiNE)\n\n\n* Discord: [https://discord.gg/Arn7TqJBvG](https://discord.gg/Arn7TqJBvG)\n\n\n* Twitter: [https://twitter.com/AffineOfficial](https://twitter.com/AffineOfficial)\n\n\n",
  "publish": true
}